{
  "$schema": "https://json-schema.org/draft/2020-12/schema",
  "$id": "https://artyx.ai/schemas/plugin-v2.schema.json",
  "type": "object",
  "required": ["schemaVersion", "name", "version", "description"],
  "additionalProperties": false,
  "properties": {
    "schemaVersion": { "const": 1 },
    "name": { "type": "string", "pattern": "^[a-z0-9]+(?:-[a-z0-9]+)*$" },
    "version": { "type": "string", "pattern": "^\\d+\\.\\d+\\.\\d+(?:[-+][0-9A-Za-z.-]+)?$" },
    "description": { "type": "string", "minLength": 1 },
    "publisher": { "type": "string", "minLength": 1 },
    "license": { "type": "string", "minLength": 1 },
    "homepage": { "type": "string", "format": "uri" },
    "repository": { "type": "string", "format": "uri" },
    "keywords": { "type": "array", "items": { "type": "string" }, "uniqueItems": true },
    "icon": { "type": "string" },
    "components": {
      "type": "object",
      "additionalProperties": false,
      "properties": {
        "skills": { "type": "string" },
        "agents": { "type": "string" },
        "mcp": { "type": "string" },
        "assets": { "type": "string" }
      }
    },
    "companion": {
      "type": "object",
      "required": ["title", "steps"],
      "additionalProperties": false,
      "properties": {
        "title": { "type": "string" },
        "summary": { "type": "string" },
        "steps": { "type": "array", "minItems": 1, "items": { "type": "string" } },
        "docsUrl": { "type": "string", "format": "uri" },
        "downloadUrl": { "type": "string", "format": "uri" },
        "prerequisites": { "type": "array", "items": { "type": "string" } }
      }
    }
  }
}
